qid,question,choices,context1,context2,context3,context4,context5,reason,predict,label
val_0047,Một trường từ đều $ B $ hướng dọc theo trục z. Một khung dây hình chữ nhật có chiều rộng $ w $ và chiều cao $ h $ nằm trong mặt phẳng xy và mang dòng điện $ I $. Khung dây ban đầu đứng yên và có thể quay quanh trục y. Độ lớn mô men xoắn tác dụng lên khung do trường từ là bao nhiêu khi mặt phẳng khung tạo một góc $ \theta $ với trục x?,"A. $ B I w h \sin(\theta) $
B. $ B I w h \cos(\theta) $
C. $ B I w h \tan(\theta) $
D. $ B I w h $
E. $ B I w h \sin(2\theta) $
F. $ B I w h \cos(2\theta) $
G. $ B I w h \sin(\theta/2) $
H. $ B I w h \cos(\theta/2) $
I. $ B I w h \tan(2\theta) $
J. $ B I w h \sin(\theta) \cos(\theta) $",,,,,,"{""large"": {""method"": ""Định luật về mô men xoắn do từ trường tác dụng lên khung dây dẫn"", ""key_expression"": ""M = B * I * A * sin(θ)"", ""step_by_step"": [""Bước 1: Xác định các thông số đã cho - Trường từ đều B, chiều rộng w, chiều cao h, dòng điện I, góc θ."", ""Bước 2: Áp dụng định luật về mô men xoắn do từ trường tác dụng lên khung dây dẫn: M = B * I * A * sin(θ), trong đó A là diện tích của khung dây (A = w * h)."", ""Bước 3: Thay số vào công thức: M = B * I * (w * h) * sin(θ).""], ""final_result"": ""M = B * I * w * h * sin(θ)""}, ""small"": ""Tôi đã kiểm tra lại biểu thức mô men xoắn do từ trường tác dụng lên khung dây: M = B * I * A * sin(θ). Diện tích khung dây A = w * h là đúng. Góc θ trong công thức là góc giữa vectơ pháp tuyến của mặt phẳng khung dây và hướng của trường từ B. Theo đề bài, mặt phẳng khung dây nằm trong mặt phẳng xy và tạo một góc θ với trục x — điều này có nghĩa là pháp tuyến của khung (dọc trục z) hợp với trường từ B (cũng dọc trục z) một góc 0°, nhưng cần hiểu rõ: góc θ trong công thức mô men xoắn là góc giữa pháp tuyến khung và B, còn đề bài nói \""mặt phẳng khung tạo góc θ với trục x\"". Vì mặt phẳng khung nằm trong xy, nên pháp tuyến của nó là trục z — cùng hướng với B. Vậy nếu mặt phẳng khung tạo góc θ với trục x, thì pháp tuyến vẫn song song với B, nên góc giữa pháp tuyến và B luôn là 0°, điều này mâu thuẫn với công thức sin(θ). \n\nThực ra, trong các tài liệu vật lý chuẩn, góc θ trong công thức M = B I A sin(θ) là góc giữa mặt phẳng khung và hướng của từ trường, hoặc thường được định nghĩa là góc giữa pháp tuyến và từ trường. Ở đây, đề bài nói: \""mặt phẳng khung tạo một góc θ với trục x\"" — nhưng trục x nằm trong mặt phẳng xy, nên nếu mặt phẳng khung (xy) tạo góc θ với trục x, thì điều này không có nghĩa vật lý rõ ràng vì mặt phẳng không thể tạo góc với một trục nằm trong nó. \n\nTôi nhận ra có sự nhầm lẫn trong diễn đạt đề bài. Tuy nhiên, trong các bài toán chuẩn, khi nói \""khung dây quay quanh trục y\"" và \""góc θ\"" thường được hiểu là góc giữa pháp tuyến khung và từ trường B (dọc z). Nếu khung ban đầu nằm trong xy (pháp tuyến z), thì khi quay quanh trục y, mặt phẳng khung sẽ nghiêng đi, và góc θ thường được định nghĩa là góc giữa pháp tuyến và B — tức là góc giữa pháp tuyến và trục z. Nhưng nếu khung vẫn nằm trong xy, thì θ = 0. \n\nTuy nhiên, trong bối cảnh bài toán này, cách diễn đạt phổ biến trong sách giáo khoa là: \""góc θ là góc giữa mặt phẳng khung và từ trường\"" — nhưng thực tế, công thức chuẩn là M = B I A sin(φ), với φ là góc giữa pháp tuyến và B. Nếu mặt phẳng khung tạo góc θ với trục x, thì do trục x nằm trong mặt phẳng xy, nên nếu khung quay quanh trục y, thì góc giữa mặt phẳng khung và mặt phẳng xy là θ, tức là góc giữa pháp tuyến và trục z là θ. Vậy φ = θ. Do đó, công thức M = B I A sin(θ) là đúng. \n\nVậy lời giải chuyên gia là chính xác. Đáp án A: B I w h sin(θ) là đúng. Ngoài ra, đáp án J: B I w h sin(θ) cos(θ) = (1/2) B I w h sin(2θ) — không phải là công thức chuẩn. \n\nKết luận: Công thức được áp dụng đúng, không có sai sót.""}",A,A
val_0048,"Đoạn thông tin:
[1] Tiêu đề: Kẻ trộm Mặt Trăng
Nội dung: Despicable Me (tạm dịch: Tôi ti tiện, phát hành ở Việt Nam dưới tên Kẻ trộm mặt trăng) là một bộ phim hoạt hình 3D của Universal Pictures và Illumination Entertainment, được phát hành ngày 9 tháng 7 năm 2010 ở Hoa Kỳ. Bộ phim có sự tham gia lồng tiếng của Steve Carell, Jason Segel, Russell Brand, Julie Andrews, Will Arnett, Kristen Wiig, và Miranda Cosgrove. Đây là bộ phim CGI đầu tiên được sản xuất bởi Universal, cùng với Illumination Entertainment. Bộ phim được dàn dựng hoàn toàn bằng máy tính tại studio Mac Guff ở Paris, Pháp.
Bộ phim kể về câu chuyện của một siêu trộm tên là Gru, vốn có âm mưu lợi dụng ba đứa trẻ mồ côi để thực hiện ý đồ xấu xa, đã tìm thấy được ở ba cô bé một tình thương yêu kì lạ, và điều này đã thay đổi con người Gru.
Bộ phim thu được các ý kiến tích cực từ các nhà phê bình, và thu về hơn 500 triệu đô-la Mỹ trên toàn thế giới, so với số vốn là 69 triệu đô-la.

I. Cốt truyện

Bộ phim bắt đầu với tin một kim tự tháp Ai Cập đã bị đánh cắp. Khi siêu trộm Gru (Steve Carell) nghe được điều này, anh ta cảm thấy danh dự bị tổn thương ghê gớm, và toan tính thực hiện một vụ trộm có thể sẽ gây chấn động nhất cả thế kỷ, đó là ăn trộm Mặt Trăng.
Gru tìm cách vay một khoản tiền từ Ngân hàng Xấu xa và gặp một siêu trộm khác tên là Vector (Jason Segel). Vector có vẻ không ưa gì Gru. Chủ tịch ngân hàng là ông Perkins (Will Arnett) không đồng ý cho Gru vay tiền cho đến khi Gru có trong tay cây Súng thu nhỏ - thứ cần thiết để thực hiện âm mưu. Ông Perkins nói với Gru rằng anh đang già đi, và những siêu trộm khác, ví dụ như Vector, trẻ hơn và có năng lực hơn - Vector chính là người đã đánh cắp kim tự tháp Ai Cập.
Gru và đám minion trộm được Súng thu nhỏ từ một phòng thí nghiệm bí mật ở Đông Á, nhưng sau đó Vector cướp mất và dùng nó để thu nhỏ máy bay của Gru. Gru tìm đủ cách để lấy lại cây súng từ nơi ở của Vector, nhưng mọi nỗ lực đột nhập vào đó đều không thành công. Khi nhìn thấy ba cô bé mồ côi là Margo (Miranda Cosgrove), Edith (Dana Gaier), và Agnes (Elsie Fisher) vào được nhà Vector để bán bánh quy, Gru nhận nuôi ba cô bé ở viện mồ côi của bà Hattie. Gru yêu cầu trợ lý là Tiến sĩ Nefario (Russell Brand) tạo nên những người máy ngụy trang thành bánh quy. Gru đưa những con người máy này cho ba cô bé giao cho Vector. Sau, đó nhờ sự trợ giúp của ba cô bé và đám người máy, Gru lấy lại được Súng thu nhỏ.
Trên đường về nhà, ba cô gái xin Gru cho vào công viên. Gru đồng ý, với ý định là sẽ bỏ ba cô gái lại đó. Nhưng người bán vé nói rằng phải có người lớn đi kèm trẻ em trong trò tàu lượn siêu tốc. Cuối cùng Gru cũng tỏ ra vui vẻ với ba cô bé. Trở về nhà, Gru trình bày kế hoạch của mình cho ông Perkins qua truyền hình. Ba cô bé cứ liên tục phá rối Gru. Một lần nữa Perkins từ chối cho Gru vay tiền, tuyên bố mặc dù kế hoạch không có vấn đề gì nhưng ông ta muốn một siêu trộm khác trẻ hơn làm việc đó. Ông Perkins gọi Vector (thực ra là con trai ông ta, tên thật là Victor) đến Ngân hàng Xấu xa để bảo rằng Gru đã lấy được Súng thu nhỏ. Về phần Gru, anh ta đã gần như từ bỏ kế hoạch do thiếu kinh phí, nhưng ba cô bé và những minion đã gây quỹ và kế hoạch vẫn được thực hiện.
Gru đứng giữa hai sự lựa chọn, vì ngày dự định đánh cắp Mặt Trăng cũng là ngày ba cô gái biểu diễn múa ballet. Tiến sĩ Nefario, thấy rằng ba cô gái có vẻ cản trở công việc của mình, bèn gọi bà Hattie đến để đưa ba cô bé về viện mồ côi. Gru vẫn tiếp tục thực hiện kế hoạch đã định.
Sau khi đã thu nhỏ và cho Mặt Trăng vào túi, Gru nhớ đến buổi diễn của ba cô gái và tức tốc quay trở về Trái Đất. Nhưng khi Gru đến nơi thì buổi biểu diễn đã kết thúc. Ở sân khấu, Gru tìm được mảnh giấy mà Vector để lại, trong đó viết: Ba cô gái đổi lấy Mặt Trăng. Khi Gru đã đưa Mặt Trăng cho Vector, Vector hủy giao kèo và giữ luôn ba cô bé cùng Mặt Trăng. Điều này làm cho Gru giận sôi và Gru đã phá hỏng hàng phòng thủ chắc chắn ngoài căn nhà của Vector. Vector trốn thoát cùng các cô gái trên một chiếc đĩa bay. Gru kịp bám vào phần dưới con tàu. Khi Gru sắp thả tay thì Tiến sĩ Nefario bay đến trên chiếc tàu bay mà Vector đã thu nhỏ lúc trước. Nefario bảo rằng, vật thể càng to thì súng thu nhỏ càng mau hết hiệu lực. Ngay sau đó Mặt Trăng -đang nằm trong đĩa bay của Vector - bỗng phình to trở lại, lớn dần và phá hỏng quả cầu đang chứa ba cô gái. Sau khi thoát được quả cầu, ba cô bé thấy Gru bên ngoài, đang bảo ba cô bé nhảy về phía mình. Edith và Agnes nhảy qua được tàu của Gru nhưng Margo chưa kịp nhảy thì Vector bắt được cô bé. Mặt Trăng lăn tròn và đánh ngã Vector, làm Margo rơi xuống. Gru cứu được cô bé với sự giúp sức của những minion. Mặt Trăng càng lúc càng to lên, phá hỏng bộ điều khiển của đĩa bay, và sau đó chiếc đĩa bay cùng Vector và Mặt Trăng, bay trở lại vào không gian.
Gru cùng ba cô bé trở về sống hạnh phúc với nhau. Ba cô bé biểu diễn một buổi đặc biệt cho Gru, không phải bài Hồ Thiên Nga mà là bài Sao bạn không nhảy đi. Và tất cả mọi người cùng lên sàn nhảy.

II. Diễn viên lồng tiếng

Steve Carell vai Gru, siêu trộm, nhân vật chính diện của phim. Roo là rap name của 1 rapper trẻ tuổi.
Jason Segel vai Vector (tên thật là Victor Perkins), siêu trộm hàng đầu thế giới sau khi anh ta đánh cắp được kim tự tháp Giza. Là nhân vật phản diện của phim.
Russell Brand vai Tiến sĩ Nefario, cố vấn, nhà khoa học, một người bạn tốt của Gru.
Julie Andrews vai Marlena, mẹ của Gru.
Will Arnett vai ông Perkins, chủ tịch Ngân hàng Xấu xa, bố của Victor.
Kristen Wiig vai bà Hattie, chủ tịch viện mồ côi.
Miranda Cosgrove vai Margo, lớn nhất trong ba chị em mồ côi.
Dana Gaier vai Edith, lớn thứ nhì trong ba chị em.
Elsie Fisher vai Agnes, nhỏ nhất trong ba chị em.
Pierre Coffin vai Tim / Bob / Mark / Phil / Stuart, những minion của Gru.
Chris Renaud vai Dave, minion của Gru.
Ken Jeong vai dẫn chương trình đối thoại.
Danny R. McBride vai Fred McDade, hàng xóm của Gru.
Jack McBrayer vai Khách du lịch nam / Người tại công viên.
Mindy Kaling vai Khách du lịch nữ.
Jemaine Clement vai Jerry, minion của Gru.

IV. Nhận xét
1. Ý kiến phê bình

Bộ phim thu được nhiều nhận xét tích cực từ các nhà phê bình. Trang Rotten Tomatoes cho biết rằng 82% ý kiến của các nhà phê bình là tích cực, dựa trên 179 bài nhận xét, với điểm trung bình là 6.8/10. Trang Metacritic đánh giá bộ phim với 72%, dựa trên 34 nhận xét.Bộ phim đã nhận được đề cử Giải Quả cầu vàng cho phim hoạt hình hay nhất ở Giải Quả cầu Vàng lần thứ 68.

V. Phần tiếp theo

Phần tiếp theo của bộ phim Despicable Me 2 đã được thực hiện và được công chiếu ở Úc vào ngày 5 tháng 6 năm 2013 và tại các rạp ở Mỹ vào ngày 3 tháng 7 năm 2013. Phần 3, Despicable Me 3 đã được thực hiện và được công chiếu ở Hoa Kỳ vào ngày 30 tháng 6 năm 2017. Tháng 9 năm 2017 , CEO của Illumination - Chris Meledandri cho biết rằng phần thứ 4 của Despicable Me đang được thực hiện.
Câu hỏi: Vector (tên thật là Victor Perkins) là con trai của nhân vật nào trong phim?","A. Perkins (chủ tịch Ngân hàng Xấu xa)
B. Gru (siêu trộm chính)
C. Tiến sĩ Nefario (nhà khoa học của Gru)
D. Marlena (mẹ của Gru)",,,,,,"Để trả lời câu hỏi này, chúng ta cần tìm kiếm thông tin về mối quan hệ giữa Vector (tên thật là Victor Perkins) và các nhân vật khác trong phim. Trong phần II. Diễn viên lồng tiếng, có thông tin rằng 'Will Arnett vai ông Perkins, chủ tịch Ngân hàng Xấu xa, bố của Victor.' Điều này cho thấy Vector (Victor Perkins) là con trai của ông Perkins, chủ tịch Ngân hàng Xấu xa.",A,A
val_0049,"Lãi suất danh nghĩa là 10% được tính theo kỳ bán niên, vậy lãi suất hàng năm hiệu quả là bao nhiêu?","A. 10.00%
B. 10.25%
C. 10.50%
D. 10.75%
E. 11.00%
F. 11.25%
G. 11.50%
H. 11.75%
I. 12.00%
J. 12.25%",,,,,,"{""large"": {""method"": ""Công thức tính lãi suất hàng năm hiệu quả"", ""key_expression"": ""(1 + r/n)^n - 1"", ""step_by_step"": [""Xác định vấn đề: Tìm lãi suất hàng năm hiệu quả khi lãi suất danh nghĩa là 10% được tính theo kỳ bán niên."", ""Thiết lập công thức: Sử dụng công thức tính lãi suất hàng năm hiệu quả: (1 + r/n)^n - 1, trong đó r là lãi suất danh nghĩa, n là số kỳ tính lãi trong năm."", ""THAY SỐ: Thay r = 10% = 0.1 và n = 2 (vì tính theo kỳ bán niên) vào công thức."", ""Tính toán: (1 + 0.1/2)^2 - 1 = (1 + 0.05)^2 - 1 = 1.1025 - 1 = 0.1025"", ""Đổi sang phần trăm: 0.1025 * 100% = 10.25%""], ""final_result"": ""10.25%""}, ""small"": ""Tôi đã tính lại biểu thức lãi suất hàng năm hiệu quả theo công thức (1 + r/n)^n - 1 với r = 10% = 0.1 và n = 2 (kỳ bán niên). Tính toán chi tiết: (1 + 0.1/2)^2 - 1 = (1.05)^2 - 1 = 1.1025 - 1 = 0.1025, tương đương 10.25%. Kết quả này đúng và phù hợp với lý thuyết tài chính về lãi suất hiệu dụng. Các bước của chuyên gia đều chính xác, không có sai sót.""}",B,B
val_0051,"Một công ty có một khoản nợ phải trả với số tiền gốc là 80.000 đô la và lãi suất hàng năm là 6%. Nếu lãi suất được tính theo kỳ hạn hàng năm, số tiền phải trả tổng cộng vào cuối 2 năm là bao nhiêu?","A. 89.600 đô la
B. 84.800 đô la
C. 89.200 đô la
D. 90.000 đô la",,,,,,"{""large"": {""method"": ""Công thức tính lãi kép hàng năm"", ""key_expression"": ""A = P(1 + r)^n"", ""step_by_step"": [""Xác định các giá trị đã biết: Số tiền gốc (P) = 80.000 đô la, Lãi suất hàng năm (r) = 6% = 0.06, Thời gian (n) = 2 năm."", ""Thay số vào công thức A = P(1 + r)^n để tính số tiền phải trả tổng cộng sau 2 năm."", ""Tính toán: A = 80.000 * (1 + 0.06)^2""], ""final_result"": ""89.760 đô la""}, ""small"": ""Tôi đã tính lại biểu thức A = P(1 + r)^n với P = 80.000, r = 0.06, n = 2. Tính toán: (1 + 0.06)^2 = 1.06^2 = 1.1236. Sau đó, A = 80.000 * 1.1236 = 89.888 đô la. Tuy nhiên, kết quả mà chuyên gia đưa ra là 89.760 đô la, đây là kết quả sai. Tôi kiểm tra lại: nếu dùng lãi đơn (không phải lãi kép), thì A = P(1 + r*n) = 80.000 * (1 + 0.12) = 89.600, trùng với đáp án A. Nhưng đề bài nói rõ 'lãi suất được tính theo kỳ hạn hàng năm' — tức là lãi kép hàng năm. Vậy kết quả đúng phải là 89.888 đô la, không có trong các lựa chọn. Tuy nhiên, 89.760 là kết quả sai của chuyên gia (có thể do tính 1.06 * 2 = 1.12 rồi nhân 80.000, sai bước lũy thừa). Trong các đáp án, 89.600 (A) là lãi đơn, 89.888 không có, nên đáp án gần nhất và hợp lý nhất nếu giả định công ty dùng lãi kép nhưng làm tròn là không có. Nhưng nếu xem xét kỹ, 89.760 có thể là do tính nhầm: 80.000 * 1.06 = 84.800 (năm 1), rồi 84.800 * 1.06 = 89.888 — không ra 89.760. Vậy chuyên gia đã tính sai. Đáp án đúng về mặt toán học là 89.888, nhưng không có trong lựa chọn. Trong các lựa chọn, A (89.600) là lãi đơn — sai vì đề yêu cầu lãi kép. Tuy nhiên, nếu xem xét các đáp án, B (84.800) là số tiền sau 1 năm, không phải 2 năm. C (89.200) và D (90.000) đều xa. Không có đáp án chính xác. Nhưng nếu bắt buộc chọn đáp án gần nhất với tính toán đúng (89.888), thì C (89.200) và A (89.600) đều gần, nhưng A là lãi đơn — không đúng với đề bài. Tuy nhiên, trong thực tế kiểm toán, nếu đề bài yêu cầu lãi kép nhưng không có đáp án đúng, ta chọn đáp án đúng về mặt công thức. Nhưng ở đây, chuyên gia đưa ra 89.760 — sai. Tôi kiểm tra lại: 80.000 * 1.06^2 = 80.000 * 1.1236 = 89.888. Không có đáp án nào khớp. Nhưng nếu nhìn lại, có thể đề bài hoặc đáp án có lỗi. Tuy nhiên, trong các lựa chọn, 89.600 (A) là kết quả của lãi đơn — thường bị nhầm lẫn. Nhưng đề bài nói rõ 'lãi suất được tính theo kỳ hạn hàng năm' — tức là lãi kép. Vậy đáp án đúng phải là 89.888, không có. Nhưng nếu phải chọn đáp án khớp nhất với kết quả kiểm tra (vì không có đáp án đúng), thì không có đáp án nào đúng. Tuy nhiên, nếu chuyên gia tính sai và ra 89.760, thì có thể họ đã dùng công thức A = P(1 + r*n) với n=2, nhưng tính r=6%*2=12%, 80.000*1.12=89.600 — vậy họ nhầm giữa lãi đơn và kép. Vậy đáp án đúng về mặt toán học là 89.888, nhưng không có. Trong các lựa chọn, không có đáp án nào đúng. Tuy nhiên, nếu bắt buộc chọn, thì đáp án A (89.600) là kết quả của công thức lãi đơn — thường là lỗi phổ biến, nhưng không đúng với đề bài. Vậy tôi kết luận: chuyên gia tính sai, và không có đáp án nào đúng. Nhưng trong bối cảnh trắc nghiệm, nếu phải chọn đáp án khớp nhất với tính toán đúng, thì không có. Tuy nhiên, nếu xem xét lại: 89.888 làm tròn đến hàng chục là 89.890 — vẫn không có. Vậy tôi nghi ngờ có lỗi in ấn. Nhưng nếu so sánh các đáp án, thì C (89.200) là gần nhất với 89.888? Không, 89.600 (A) gần hơn: |89.888 - 89.600| = 288, |89.888 - 89.200| = 688. Vậy A gần hơn. Nhưng A là lãi đơn — sai về mặt lý thuyết. Tuy nhiên, trong thực tế kiểm toán, nếu đề bài yêu cầu lãi kép nhưng đáp án không có, ta phải chọn đáp án đúng về mặt công thức. Nhưng ở đây, không có. Vậy tôi sẽ chọn đáp án A vì nó là kết quả của công thức phổ biến bị nhầm, và là đáp án gần nhất — nhưng tôi phải ghi nhận rằng đáp án đúng là 89.888, không có trong lựa chọn. Tuy nhiên, nếu kiểm tra lại công thức: có thể đề bài muốn lãi đơn? Không, vì nói rõ 'tính theo kỳ hạn hàng năm' — nghĩa là lãi kép. Vậy tôi kết luận: chuyên gia sai, và không có đáp án đúng. Nhưng trong các lựa chọn, nếu phải chọn một, thì không có đáp án nào đúng. Tuy nhiên, nếu tôi xem lại: 80.000 * 1.06 = 84.800 (năm 1), 84.800 * 1.06 = 89.888 (năm 2). Vậy đáp án đúng là 89.888. Không có. Nhưng nếu nhìn vào đáp án C: 89.200 — có thể do tính 1.05^2? 1.05^2=1.1025, 80.000*1.1025=88.200 — không phải. Vậy tôi không thể chọn C. D: 90.000 — quá cao. B: 84.800 — chỉ là năm đầu. Vậy chỉ còn A: 89.600 — là lãi đơn. Trong nhiều kỳ thi, nếu không có đáp án đúng, họ chọn đáp án gần nhất — và A là gần nhất. Nhưng về mặt kiểm toán, tôi phải nói: đáp án đúng là 89.888, không có trong lựa chọn. Tuy nhiên, nếu buộc phải chọn một đáp án, thì tôi chọn A vì nó là kết quả của công thức lãi đơn — và là đáp án gần nhất. Nhưng tôi không đồng ý với chuyên gia vì họ ra 89.760 — sai. Vậy tôi chọn A vì nó là đáp án gần nhất với kết quả đúng (89.888) trong các lựa chọn, dù sai về lý thuyết. Nhưng thực ra, 89.600 là 288 đơn vị chênh lệch, còn nếu có đáp án 89.900 thì sẽ chọn đó. Vậy tôi chọn A.""}",A,A
