qid,question,choices,context1,context2,context3,context4,context5,reason,predict,label
val_0001,"Đoạn thông tin:
[1] Tiêu đề: Khỉ thí nghiệm
Nội dung: Khỉ thí nghiệm là thuật ngữ chỉ về các loài linh trưởng (trừ con người), thông thường là các loài khỉ được sử dụng trong thí nghiệm y khoa (NHPs). Khỉ bao gồm các loài khỉ thực sự và các loài khỉ lớn (Ape) được sử dụng cho các mục đích thí nghiệm khoa học, nhất là trong y học. Xuất phát từ sự tương đồng của về cấu trúc sinh học giữa các loài khỉ và người do đó chúng thường được nuôi để làm vật thí nghiệm liên quan đến y khoa, trên cơ sở đó sẽ nhân rộng ra cho con người.
Có 22 loài khỉ đuôi dài, trong đó một số được sử dụng thường xuyên trong các thí nghiệm khoa học. Khỉ vàng là nguồn nguyên liệu đầu để sản xuất hàng chục triệu liều văcxin bại liệt mỗi năm, góp phần vào việc thanh toán hoàn toàn bệnh bại liệt tại Việt Nam vào những năm 2000 Được sử dụng trong sản xuất vacxin chống bệnh bại liệt trẻ em, làm vật mẫu, đối tượng nghiên cứu khoa học. Khỉ vàng được lựa chọn là đối tượng nghiên cứu của các đề tài khoa học cũng như kiểm định chất lượng, thử nghiệm tiền lâm sàng nhiều sản phẩm sinh học và văcxin.

I. Tổng quan

Các loài linh trưởng nói chung và khỉ nói riêng được sử dụng rộng rãi trong thực nghiệm y học, đặc biệt chúng gắn liền với khoa học về thần kinh và một số bệnh lý. Do đặc tính sinh lý của chúng liên quan gần với con người, nên chúng có thể chia sẻ một số bệnh truyền nhiễm với con người. Theo thống kê y học, khỉ cũng mắc các bệnh thường có ở người như: virus herpes, thủy đậu (varicella), dại, sốt xuất huyết, bại liệt, cúm, sởi, viêm gan A, viêm gan B. Trong một số trường hợp, ký sinh trùng Plasmodium knowlesi gây bệnh sốt rét trên khỉ cũng có thể gây nhiễm sốt rét trên người, một số trường hợp đã được báo cáo trên người, thậm chí gây sốt rét ác tính và tử vong. Trong giới động vật, khỉ là loài gần gũi với con người nhất. Do cơ thể gần tương đồng với cơ thể người nên các loài khỉ, đặc biệt là khỉ nuôi dài có nguồn gốc gây nuôi sinh sản có tác dụng tốt cho công tác nghiên cứu y học. Nhiều cơ sở y học hàng đầu trên thế giới ở Mỹ, Anh, Pháp đều sử dụng khỉ đuôi dài làm vật thí nghiệm các loại vaccine trước khi sử dụng phổ biến ở người.
Cơ thể khỉ gần giống người, nên trong y học khỉ là đối tượng để nghiên cứu bệnh học, y học thực nghiệm, từ đó để có biện pháp giải quyết chữa bệnh cho người. Người ta đã nghiên cứu nhiều bộ phận cơ thể của khỉ để ghép cho người như thận, tim, gan. Tuy nhiên, bệnh nhân được ghép cũng không sống được lâu. Trong sản xuất vacxin chống các bệnh vi rút, người ta cũng dùng một số bộ phận của khỉ. Ngoài ra, để phục vụ cho công việc nghiên cứu và sản xuất vắc-xin phòng các bệnh cho con người, hàng ngày có những con khỉ đã âm thầm bị hiến thận cho những công việc. Vì bản thân tế bào thận Khỉ không mang bất kỳ tác nhân truyền nhiễm lạ, hoặc nguy cơ gây bệnh hiểm nghèo cho con người. Chẳng hạn, khi tiến hành bào chế vắc-xin Sabin phòng bệnh bại liệt, hoặc vắc–xin phòng dịch cúm H5N1, người ta đã sử dụng tế bào thận khỉ vàng để làm công việc đó

II. Quy trình

Vì cơ địa khỉ vàng gần giống với con người, nên trong những năm gần đây khỉ vàng lại là vật thí nghiệm để thử phản ứng các loại vắc-xin H5N1, H1N1 trước khi tiêm vào con người. Khỉ ở được chọn là giống khỉ lông vàng đuôi ngắn, chúng có cơ thể tương đối sạch, ít bị nhiễm các mầm bệnh hơn các loài khỉ khác. Mỗi lần thử nghiệm có từ 30 đến 50 con khỉ khoảng 1 năm tuổi, chúng được tiêm, được uống, được chăm sóc, nuôi nhốt theo dõi hết sức cẩn thận trong quá trình nghiên cứu.
Khỉ được chọn ra để chiết vắc-xin thường là khỉ con một năm rưỡi đến hai năm tuổi, có trọng lượng khoảng 2,5 kg (khỉ trưởng thành nặng trung bình từ 6–7 kg, có con nặng tới 13 kg). Những chú khỉ đủ tiêu chuẩn được lựa chọn tiến hành nghiên cứu là những chú khỉ trong độ tuổi 1,5-2 năm tuổi, cân nặng từ 1,5–2 kg và thường chọn khỉ đực để nghiên cứu vì khỉ cái còn dùng để sinh sản. Những con khỉ được lựa chọn sẽ được nuôi cách ly và kiểm tra xác nhận không có mầm bệnh, đưa về Trung tâm Nghiên cứu, sản xuất văcxin và sinh phẩm y tế (POLYVAC).
Sau đó, những chuyên gia tại đây sẽ phẫu thuật lấy thận, tách các tế bào thận riêng rẽ để nuôi cấy trên các chai thủy tinh bằng môi trường phát triển, khi tế bào đã phát triển phủ kín một lớp trên bề mặt chai sẽ được gây nhiễm chủng virút polio đã giảm độc lực. Chủng virút này nhân lên trên tế bào, trưởng thành và giải phóng ra khỏi tế bào tạo thành hỗn dịch văcxin bại liệt bán thành phẩm đơn type. Khi sản xuất văcxin thành phẩm sẽ tiến hành phối trộn ba type virút, bổ sung chất bảo quản, lọc vô trùng và đóng lọ để trở thành văcxin thành phẩm. Mỗi con khỉ chiết được gần một triệu liều vắc-xin giúp trẻ em thoát khỏi nhiều căn bệnh hiểm nghèo.

III. Nhân nuôi

Loài được nuôi sinh sản nhiều nhất ở Việt Nam là khỉ đuôi dài. Tại Việt Nam cũng như một số nước trên thế giới, mặc dù nằm trong nhóm các loài nguy cấp với số lượng ít trong tự nhiên, khỉ đuôi dài lại có khả năng sinh sản rất tốt trong điều kiện gây nuôi. Ở các tỉnh phía nam Việt Nam, khỉ đuôi dài đã được gây nuôi sinh sản thành công tại một số trại gây nuôi động vật hoang dã với số lượng sinh sản hàng nghìn cá thể mỗi năm. Với tốc độ sinh sản tốt (2 lứa/3 năm), khỉ đuôi dài đã góp phần đa dạng hóa các loại hình sản xuất nông nghiệp, đem lại nguồn thu khoảng 3-4 triệu USD/năm cho kinh tế đất nước, tạo ra công ăn việc làm cho người lao động. Một quần thể khỉ mặt đỏ lông nâu sinh sôi nảy nở trong các khu đầm lầy của Florida, đặc biệt là tại Khu vườn quốc gia Silver. Khỉ được đưa đến phong thí nghiệm sinh học đặt ở đây từ năm 1938. Sáu mươi sáu năm sau (1992) trận bão khủng khiếp mang tên Andrew, gây thiệt hại lớn về người và của, đã phá hủy nghiêm trọng các phòng thí nghiệm. Đàn khỉ nâu bị xô đẩy ra tự nhiên Florida. Khỉ nâu là loài rất hung dữ, nên người ta đã khuyên du khách không nên tiếp xúc với chúng.

IV. Ở Việt Nam

Khỉ còn là vật thí nghiệm để sản xuất thuốc ở Việt Nam. Đảo khỉ ở Việt Nam là hòn đảo độc nhất vô nhị ở Việt Nam, nơi đây đã và đang nuôi dưỡng hàng ngàn con khỉ trong điều kiện bán hoang dã để phục vụ cho những thí nghiệm khoa học, sản xuất vaccin và nhiều sinh phẩm y tế phục vụ cho sự nghiệp cứu người chúng đang được nuôi rất nhiều ở đảo Rều thuộc Quảng Ninh với số lượng hơn 1.000 cá thể khỉ vàng được nuôi trên đảo Rều phục vụ sản xuất văcxin và các công trình nghiên cứu y học. Đây là những chú khỉ được nuôi để sản xuất văcxin bại liệt và phục vụ nhiều công trình nghiên cứu y học.
Năm 1962, đảo Rều được Bộ Y tế đầu tư thành trại nuôi khỉ để nghiên cứu y học phục vụ sản xuất các loại văcxin phòng bại liệt, viêm gan A, thuốc phòng chống virút H5N1. Người ta dùng tế bào thận của loài khỉ vàng để điều chế các loại văcxin giúp khống chế nhiều bệnh tật truyền nhiễm nguy hiểm. Nhiều thế hệ khỉ đã góp công lớn cho sự nghiệp nghiên cứu, phát triển y học Việt Nam. Nhờ sự cống hiến của giống khỉ vàng, dịch bệnh bại liệt tại Việt Nam đã bị đẩy lùi. Khỉ vàng là nguồn nguyên liệu đầu để sản xuất hàng chục triệu liều văcxin bại liệt mỗi năm, góp phần vào việc thanh toán hoàn toàn bệnh bại liệt tại Việt Nam vào những năm 2000.
Câu hỏi: Loài khỉ nào được sử dụng phổ biến nhất trong sản xuất vắc-xin bại liệt và các loại vắc-xin phòng virus H5N1 ở Việt Nam?","A. Khỉ đuôi dài
B. Khỉ vàng
C. Khỉ nâu
D. Khỉ mặt đỏ lông nâu",,,,,,"Để trả lời câu hỏi này, cần phân tích thông tin trong đoạn văn về loài khỉ được sử dụng phổ biến nhất trong sản xuất vắc-xin bại liệt và các loại vắc-xin phòng virus H5N1 ở Việt Nam. Đoạn văn cung cấp thông tin chi tiết về việc sử dụng khỉ trong sản xuất vắc-xin, đặc biệt nhấn mạnh vai trò của khỉ vàng trong việc sản xuất vắc-xin bại liệt và các loại vắc-xin phòng virus H5N1. Theo thông tin trong đoạn văn, khỉ vàng là nguồn nguyên liệu đầu để sản xuất hàng chục triệu liều văcxin bại liệt mỗi năm, góp phần vào việc thanh toán hoàn toàn bệnh bại liệt tại Việt Nam vào những năm 2000. Ngoài ra, khỉ vàng cũng được sử dụng để thử phản ứng các loại vắc-xin H5N1, H1N1 trước khi tiêm vào con người. Do đó, dựa trên thông tin trong đoạn văn, khỉ vàng là loài khỉ được sử dụng phổ biến nhất trong sản xuất vắc-xin bại liệt và các loại vắc-xin phòng virus H5N1 ở Việt Nam.",B,B
val_0002,Ngôi chùa Ba La Mật được khai dựng vào năm nào?,"A. 1886
B. 1900
C. 1920
D. 1930",,,,,,"Không có tài liệu tham khảo nào được cung cấp cho câu hỏi này. Tuy nhiên, dựa trên kiến thức chung về lịch sử và kiến trúc tôn giáo tại Việt Nam, ngôi chùa Ba La Mật thường được biết đến với lịch sử lâu đời. Vì không có thông tin cụ thể về năm khai dựng của ngôi chùa này trong các tài liệu tham khảo, tôi sẽ dựa vào kiến thức chung và khả năng suy luận để đưa ra một giả định hợp lý. Thông thường, các ngôi chùa lớn và nổi tiếng tại Việt Nam được xây dựng trong khoảng thời gian từ cuối thế kỷ 19 đến đầu thế kỷ 20, khi phong trào xây dựng và phục hồi các công trình tôn giáo diễn ra mạnh mẽ. Do đó, tôi sẽ chọn một năm nằm trong khoảng thời gian này làm đáp án.",A,A
val_0004,"Một cửa hàng tạp hóa địa phương đã tăng giá một món đồ ăn vặt phổ biến từ 2,00 đô la lên 2,50 đô la, và lượng cầu giảm từ 100 đơn vị xuống 80 đơn vị. Sử dụng công thức trung điểm, hãy xác định độ co giãn của cầu theo giá đối với món đồ ăn vặt này?","A. -0,5
B. -1,0
C. -1,5
D. -2,0",,,,,,"{""large"": {""method"": ""Công thức trung điểm để tính độ co giãn của cầu theo giá"", ""key_expression"": ""(ΔQ/Q_trung_bình) / (ΔP/P_trung_bình)"", ""step_by_step"": [""Bước 1: Xác định giá ban đầu (P1) và giá mới (P2): P1 = 2,00 đô la, P2 = 2,50 đô la."", ""Bước 2: Xác định lượng cầu ban đầu (Q1) và lượng cầu mới (Q2): Q1 = 100 đơn vị, Q2 = 80 đơn vị."", ""Bước 3: Tính giá trung bình (P_trung_bình) và lượng cầu trung bình (Q_trung_bình): P_trung_bình = (P1 + P2) / 2 = (2,00 + 2,50) / 2 = 2,25 đô la; Q_trung_bình = (Q1 + Q2) / 2 = (100 + 80) / 2 = 90 đơn vị."", ""Bước 4: Tính sự thay đổi về giá (ΔP) và sự thay đổi về lượng cầu (ΔQ): ΔP = P2 - P1 = 2,50 - 2,00 = 0,50 đô la; ΔQ = Q2 - Q1 = 80 - 100 = -20 đơn vị."", ""Bước 5: Áp dụng công thức trung điểm để tính độ co giãn của cầu theo giá: Độ co giãn = (ΔQ/Q_trung_bình) / (ΔP/P_trung_bình) = (-20/90) / (0,50/2,25) = -0,2222 / 0,2222 ≈ -1.""], ""final_result"": ""-1""}, ""small"": ""Tôi đã tính lại biểu thức độ co giãn của cầu theo giá theo công thức trung điểm: Độ co giãn = (ΔQ / Q_trung_bình) / (ΔP / P_trung_bình). Với ΔQ = 80 - 100 = -20, Q_trung_bình = (100 + 80) / 2 = 90, ΔP = 2.50 - 2.00 = 0.50, P_trung_bình = (2.00 + 2.50) / 2 = 2.25. Tính toán: (-20 / 90) = -0.2222..., (0.50 / 2.25) = 0.2222..., nên độ co giãn = -0.2222 / 0.2222 = -1. Kết quả này chính xác và khớp với lời giải chuyên gia.""}",B,B
val_0005,"Điện trở tương đương khi hai điện trở, R1 và R2, được mắc song song là gì?","A. R1 + R2
B. R1 - R2
C. (R1 * R2) / (R1 + R2)
D. (R1 + R2) / (R1 * R2)
E. R1 * R2
F. R1 / R2
G. R2 / R1
H. 1 / (R1 + R2)
I. 1 / (R1 * R2)
J. (R1 + R2) / 2",,,,,,"{""large"": {""method"": ""Công thức tính điện trở tương đương cho mạch song song"", ""key_expression"": ""1/Rt = 1/R1 + 1/R2"", ""step_by_step"": [""Bước 1: Xác định vấn đề - Tìm điện trở tương đương Rt khi R1 và R2 mắc song song."", ""Bước 2: Thiết lập công thức - Sử dụng công thức tính điện trở tương đương cho mạch song song: 1/Rt = 1/R1 + 1/R2."", ""Bước 3: Không cần thay số vì câu hỏi không cung cấp giá trị cụ thể cho R1 và R2. Công thức đã đủ để thể hiện mối quan hệ giữa Rt, R1, và R2."", ""Bước 4: Kết luận - Điện trở tương đương Rt được tính bằng công thức trên.""], ""final_result"": ""Rt = 1 / (1/R1 + 1/R2)""}, ""small"": ""Tôi đã kiểm tra lại biểu thức điện trở tương đương khi hai điện trở R1 và R2 mắc song song. Công thức gốc là: 1/Rt = 1/R1 + 1/R2. Từ đó, tôi đã biến đổi để tìm Rt: Rt = 1 / (1/R1 + 1/R2). Sau đó, tôi rút gọn biểu thức này: 1/R1 + 1/R2 = (R2 + R1)/(R1*R2), nên Rt = 1 / [(R1 + R2)/(R1*R2)] = (R1*R2)/(R1 + R2). Kết quả này trùng với lựa chọn C. Các bước của chuyên gia đúng, công thức được suy ra chính xác và không có sai sót logic hay toán học.""}",C,C
val_0006,Bạn nên làm gì khi bắt tay?,"A. Nhìn đi hướng khác
B. Nhìn xuống đất
C. Giao tiếp bằng mắt và mỉm cười
D. Nhìn xung quanh theo mọi hướng","Hãy nhìn thẳng vào người đối diện với sự chân thành. Nếu bạn không thể duy trì giao tiếp bằng mắt, người khác có thể nghĩ bạn đang che giấu điều gì đó hoặc bạn không chắc chắn. Đưa ra một cái bắt tay vững chắc.
Đọc giao tiếp phi ngôn ngữ Có thể đọc được giao tiếp phi ngôn ngữ của người khác có thể hỗ trợ đáng kể trong quá trình giao tiếp. Bằng cách nhận thức được sự mâu thuẫn giữa giao tiếp bằng lời nói và phi ngôn ngữ của một người và hòa giải chúng, các nhà đàm phán có thể đi đến các đề nghị tốt hơn. Ví dụ về tính phi lý trong ngôn ngữ cơ thể bao gồm:
 Cười lo lắng: Một tiếng cười không phù hợp với tình hình. Đây có thể là dấu hiệu của sự căng thẳng hoặc khó chịu. Khi điều này xảy ra, nó có thể là tốt để thăm dò với các câu hỏi để khám phá cảm xúc thật của người đó.","Do đó, các quy tắc xã hội nói với một người phụ nữ cách cư xử theo cách nữ tính, và một người đàn ông, làm thế nào để đàn ông. Các quy tắc khác như sau:

 Người lạ được giới thiệu bắt tay, như trong xã hội phương Tây, nhưng 
 Cúi đầu về phía nhau, ở Hàn Quốc, Nhật Bản và Trung Quốc 
 Miễn nhau ở Thái Lan 
 Đừng cúi đầu chào nhau, theo truyền thống Do Thái 
 Ở Hoa Kỳ, ánh mắt, cái gật đầu về phía nhau và một nụ cười, không cúi đầu; lòng bàn tay hướng sang một bên, không hướng lên hay hướng xuống, trong một cái bắt tay kinh doanh. 
 Trao danh thiếp cho nhau, trong các cuộc họp kinh doanh (cả hai tay tại Nhật Bản) 
 Nhấp gót cùng nhau, trong khi chào trong một số bối cảnh quân sự 
 Một người phụ nữ cúi chào (curtsey), trong một số xã hội 
 Ở Trung Đông, không bao giờ hiển thị lòng bàn chân về phía người khác, vì điều này sẽ được coi là một sự xúc phạm nghiêm trọng.","Con người giao tiếp với nhau bằng nhiều loại hình ngôn ngữ khác nhau. Trong một số tình huống nhất định, con người không thể sử dụng ngôn ngữ nói mà phải sử dụng ngôn ngữ cử chỉ và ngược lại. Một cái bắt tay, một cái vẫy tay, một ánh mắt, một nụ cười, một nụ hôn... thậm chí một vũ điệu nào đó cũng được xem là ngôn ngữ cử chỉ. Một đứa trẻ chưa biết nói thường khóc, cười hay dùng tay chỉ khi muốn ai đó làm giúp điều gì. Tặng hoa, tặng quà... là một trong những cách biểu đạt ngôn ngữ cử chỉ để ""thay lời muốn nói"". Người Việt có câu: ""nhìn quân phục, biết tư cách"". Vậy, cách ăn mặc cũng nói lên sự biểu đạt ngôn ngữ cử chỉ. Ở sân cỏ, người trọng tài ""giao tiếp"" với các cầu thủ bằng cái còi. Tiếng vỗ tay đồng nghĩa với tán thành. Mút tay, gãi đầu thể hiện sự thiếu tự tin, e ngại hay bối rối. Nhịp chân, rung đùi thể hiện sự thoải mái. Gật đầu khi tâm đắc một điều gì. Đôi khi, ""im lặng là đồng ý""...","Một cái bắt tay, một cái vẫy tay, một ánh mắt, một nụ cười, một nụ hôn... thậm chí một vũ điệu nào đó cũng được xem là ngôn ngữ cử chỉ.

Một đứa trẻ chưa biết nói thường khóc, cười hay dùng tay chỉ khi muốn ai đó làm giúp điều gì. 
Tặng hoa, tặng quà... là một trong những cách biểu đạt ngôn ngữ cử chỉ để ""thay lời muốn nói"". Người Việt có câu: ""nhìn quân phục, biết tư cách"". Vậy, cách ăn mặc cũng nói lên sự biểu đạt ngôn ngữ cử chỉ. Ở sân cỏ, người trọng tài ""giao tiếp"" với các cầu thủ bằng cái còi.

Tiếng vỗ tay đồng nghĩa với tán thành. Mút tay, gãi đầu thể hiện sự thiếu tự tin, e ngại hay bối rối. Nhịp chân, rung đùi thể hiện sự thoải mái. Gật đầu khi tâm đắc một điều gì. Đôi khi, ""im lặng là đồng ý""...

Ý nghĩa
Ngôn ngữ ký hiệu, ""ngôn ngữ câm"" dù không nói thành lời nhưng ý nghĩa của nó thì rất quan trọng

Đặc điểm

Các chuyển động của đôi tay 
Đặc biệt, ngôn ngữ đôi tay là được sử dụng đến nhiều nhất.","Khoảng cách thân mật được coi là thích hợp với những mối quan hệ quen thuộc và thể hiện sự gần gũi và tin tưởng. Khoảng cách cá nhân vẫn khá gần nhưng luôn giữ khoảng cách ""một cánh tay"" với một người khác – khoảng cách thoải mái nhất cho hầu hết quan hệ của chúng ta. Khoảng cách xã hội sử dụng trong giao tiếp trong các mối quan hệ công việc và đôi khi là trong phòng học. Khoảng cách công cộng xảy ra trong trường hợp giao tiếp hai chiều không cần thiết hoặc không khả thi.

Giao tiếp bằng mắt 

Một ví dụ cho giao tiếp bằng mắt là khi hai người nhìn vào mắt nhau cùng một lúc, nó là phương thức giao tiếp phi ngôn ngữ cơ bản chỉ ra sự gắn bó, sự quan tâm, sự chú ý và sự liên quan. Nhiều nghiên cứu đã tìm ra rằng con người dùng mắt của họ để biểu hiện sự thích thú. Nó bao gồm những ghi nhận về tần số của hoạt động nháy mắt và sự chuyển động của lông mày. Sự hờ hững được đặc biệt chú ý khi không có hoặc chỉ rất ít giao tiếp bằng mắt được thực hiện trong môi trường xã hội. Tuy nhiên khi cá nhân thể hiện sự quan tâm thì đồng tử sẽ dãn ra.","Khi bắt tay, hành động này thường diễn ra trong một tình huống xã hội hoặc kinh doanh, nơi giao tiếp phi ngôn ngữ đóng vai trò quan trọng. Theo Tài liệu tham khảo 1, việc nhìn thẳng vào người đối diện với sự chân thành và đưa ra một cái bắt tay vững chắc là cách thể hiện sự tự tin và tôn trọng. Điều này cũng được hỗ trợ bởi Tài liệu tham khảo 2, nơi nó đề cập đến việc giao tiếp bằng mắt, cái gật đầu về phía nhau và một nụ cười là những hành vi phù hợp trong giao tiếp xã hội tại Hoa Kỳ. Ngoài ra, Tài liệu tham khảo 3 và 4 cũng nhấn mạnh tầm quan trọng của giao tiếp phi ngôn ngữ, bao gồm cả giao tiếp bằng mắt và nụ cười, trong việc thể hiện sự thân thiện và mở lòng. Do đó, khi bắt tay, hành động phù hợp nhất là giao tiếp bằng mắt và mỉm cười để thể hiện sự tôn trọng, tự tin và thân thiện.",C,C
