qid,question,choices,context1,context2,context3,context4,context5,reason,predict,label
val_0070,"Hệ thống chính trị là chỉnh thể các thiết chế thực thi quyền lực chính trị, bao gồm các bộ phận cấu thành là:","A. Đảng chính trị
B. Nhà nước
C. Các tổ chức chính trị-xã hội
D. Tất cả các phương án trên","Điều này hàm chỉ các tổ chức là thực thể cấu thành hệ thống chính trị có chức năng thực thi quyền lực chính trị

Tổ chức chính trị 
Tổ chức chính trị hay Hệ thống chính trị là một chỉnh thể các thiết chế quyền lực chính trị, được xã hội thừa nhận bao gồm các tổ chức chính trị như Đảng phái, Nhà nước và các tổ chức chính trị - xã hội có mối quan hệ mang tính pháp quy với nhau cùng liên kết nhằm thực hiện mục tiêu chính trị phù hợp với lợi ích của giai cấp thống trị. Cấu thành hệ thống chính trị bao gồm các thực thể nhưː Đảng chính trị, Nhà nước, các tổ chức đại diện cho các lực lượng khác nhau trong xã hội.

Đảng phái chính trị 
Đảng là một tổ chức xã hội tự nguyện, tập hợp những người có những đặc điểm chung nhất định, tuân thủ theo những quy tắc nhất định, cùng thực hiện những nhiệm vụ nhất định nhằm thỏa mãn mục tiêu nào đó.","Yếu tố cấu thành

Thể chế pháp lý 
Thể chế pháp lý là tổng thể các quy phạm pháp luật, có mối liên hệ chặt chẽ, thống nhất, quy định nguyên tắc, trình tự, thủ tục, nội dung, hậu quả pháp lý của việc kiểm soát quyền lực nhà nước, được biểu hiện trong các văn bản quy phạm pháp luật.

Thiết chế 
Các thiết chế kiểm soát quyền lực nhà nước bao gồm các cơ quan trong bộ máy của nhà nước như: Quốc hội, Chủ tịch nước, Chính phủ, Thủ tướng Chính phủ, Tòa án nhân dân, Viện kiểm sát nhân dân, Kiểm toán nhà nước, Hội đồng bầu cử quốc gia, Hội đồng nhân dân và Ủy ban nhân dân các cấp; và các thiết chế bên ngoài như: Đảng Cộng sản Việt Nam, Mặt trận Tổ quốc, Công đoàn, Hội nông dân, Đoàn thanh niên, Hội liên hiệp phụ nữ, Hội cựu chiến binh, Các tổ chức xã hội, nghề nghiệp…

Ghi chú 

Chính trị
Chính trị học","An ninh chính trị là một bộ phận của an ninh quốc gia, có nội dung chính là đảm bảo sự ổn định chính trị, trật tự xã hội; nghĩa là đảm bảo hiệu quả và hiệu lực của quyền lực chính trị trong quốc gia đó; trong đó, vấn đề cốt lõi nhất là bảo vệ chủ quyền quốc gia.

Chủ quyền quốc gia 
Chủ quyền quốc gia bao gồm: chủ quyền lãnh thổ (chủ quyền đất liền, không phận, hải phận), thể chế chính trị (chế độ chính trị và các thiết chế chính trị cụ thể), tư tưởng chính trị (hệ chính trị tư tưởng nền tảng, các giá trị và chuẩn mực văn hóa chính trị).

Nội dung 

 An ninh về tư tưởng. Đảm bảo an ninh về tư tưởng bao gồm việc bảo vệ hệ tư tưởng nền tàng, bản sắc văn hóa và đại đoàn kết dân tộc.
 An ninh về thể chế chính trị bao gồm ba vấn đề chính là bảo vệ chế độ chính trị, các thiết chế nhà nước và các tổ chức chính trị - xã hội (bảo vệ Đảng, Nhà nước và các tổ chức chính trị - xã hội).","Bộ máy của đảng có quan hệ trực tiếp với bộ máy nhà nước. Trong đó 1 công chức đảng nào đó hoặc 1 nhóm công chức trong bộ máy của đảng sẽ chịu trách nhiệm về tất cả các lĩnh vực quan trọng của hoạt động nhà nước.

Các tổ chức chính trị xã hội
Nhiều tổ chức, hiệp hội trong xã hội được gọi chung là các tổ chức quần chúng. Đặc điểm chính của các tổ chức này là mỗi tổ chức được quản lý 1 lĩnh vực nhất định.

Sự độc quyền về tổ chức tạo cho các tổ chức đại chúng có chức năng đồng thời như 1 cơ quan có thẩm quyền.

Cách thức xây dựng và điều hành các tổ chức quần chúng chủ yếu trên cơ sở cụ thể hóa chủ trương, đường lối đã định sẵn của đảng. Vì vậy, các tổ chức quần chúng nếu có tham gia vào quá trình bầu cử cơ quan đại diện nhân dân hoặc quá trình xây dựng chính sách thì chủ yếu là theo định hướng đã vạch sẵn. Đó chính là nét đặc trưng của hệ thống không chấp nhận đa nguyên chính trị.","Tất cả quyền lực nhà nước thuộc về nhân dân mà nền tảng là liên minh giữa giai cấp công nhân với giai cấp nông dân và đội ngũ trí thức, do Đảng Cộng sản Việt Nam lãnh đạo. Quyền lực nhà nước là thống nhất; có sự phân công, phối hợp và kiểm soát giữa các cơ quan trong việc thực hiện các quyền lập pháp, hành pháp, tư pháp. Nhà nước ban hành pháp luật; tổ chức, quản lý xã hội bằng pháp luật, không ngừng tăng cường pháp chế xã hội chủ nghĩa. Mặt trận Tổ quốc Việt Nam, các đoàn thể nhân dân có vai trò rất quan trọng trong sự nghiệp đại đoàn kết toàn dân tộc xây dựng và bảo vệ Tổ quốc. Mặt trận Tổ quốc Việt Nam là tổ chức liên minh chính trị, liên hiệp tự nguyện của tổ chức chính trị, tổ chức chính trị-xã hội, tổ chức xã hội và các cá nhân tiêu biểu trong các giai cấp, tầng lớp xã hội, các dân tộc, tôn giáo và người Việt Nam định cư ở nước ngoài. Mặt trận Tổ quốc Việt Nam là một bộ phận của hệ thống chính trị, là cơ sở chính trị của chính quyền nhân dân.","Hệ thống chính trị là một chỉnh thể các thiết chế quyền lực chính trị, được xã hội thừa nhận bao gồm các tổ chức chính trị như Đảng phái, Nhà nước và các tổ chức chính trị - xã hội có mối quan hệ mang tính pháp quy với nhau cùng liên kết nhằm thực hiện mục tiêu chính trị phù hợp với lợi ích của giai cấp thống trị. Cấu thành hệ thống chính trị bao gồm các thực thể như: Đảng chính trị, Nhà nước, các tổ chức đại diện cho các lực lượng khác nhau trong xã hội.",D,D
val_0071,"Xét các điểm $ A(1, 2) $, $ B(4, 6) $, và $ C(7, 2) $ trong mặt phẳng tọa độ. Một đường thẳng $ L $ đi qua điểm $ A $ và song song với đoạn thẳng $ BC $. Phương trình của đường thẳng $ L $ là gì?","A. $ y = \frac{4}{3}x - \frac{2}{3} $
B. $ y = \frac{3}{4}x + \frac{5}{4} $
C. $ y = -\frac{4}{3}x + \frac{10}{3} $
D. $ y = -\frac{3}{4}x + \frac{11}{4} $
E. $ y = \frac{4}{3}x + \frac{2}{3} $
F. $ y = \frac{3}{4}x - \frac{1}{4} $
G. $ y = -\frac{3}{4}x + \frac{13}{4} $
H. $ y = \frac{4}{3}x - \frac{10}{3} $
I. $ y = \frac{3}{4}x + \frac{7}{4} $
J. $ y = -\frac{4}{3}x + \frac{8}{3} $",,,,,,"{""large"": {""method"": ""Định luật về đường thẳng song song"", ""key_expression"": ""y = mx + b, với m là hệ số góc của đường thẳng BC"", ""step_by_step"": [""Bước 1: Tìm hệ số góc của đoạn thẳng BC bằng cách sử dụng công thức: m = (y2 - y1) / (x2 - x1), với (x1, y1) = (4, 6) và (x2, y2) = (7, 2)"", ""Bước 2: Thay số vào công thức trên để tìm m: m = (2 - 6) / (7 - 4) = -4/3"", ""Bước 3: Vì đường thẳng L song song với đoạn thẳng BC, nên hệ số góc của đường thẳng L cũng là -4/3"", ""Bước 4: Sử dụng điểm A(1, 2) và hệ số góc -4/3 để tìm phương trình của đường thẳng L theo dạng y = mx + b"", ""Bước 5: Thay số vào công thức y = mx + b để tìm b: 2 = (-4/3)(1) + b => b = 10/3"", ""Bước 6: Viết phương trình của đường thẳng L dưới dạng y = mx + b""], ""final_result"": ""y = -4/3x + 10/3""}, ""small"": ""Tôi đã kiểm tra lại biểu thức chính: y = -4/3x + 10/3. Bước 1: Tính hệ số góc của BC: m = (2 - 6)/(7 - 4) = (-4)/3 = -4/3 → đúng. Bước 2: Đường thẳng L song song với BC nên có cùng hệ số góc -4/3 → đúng. Bước 3: Thay điểm A(1, 2) vào y = (-4/3)x + b: 2 = (-4/3)(1) + b → b = 2 + 4/3 = 6/3 + 4/3 = 10/3 → đúng. Vậy phương trình là y = -4/3x + 10/3, trùng với lựa chọn C. Các bước và kết quả của chuyên gia đều chính xác.""}",C,C
val_0072,"Đoạn thông tin:
[1] Tiêu đề: Ném đá
Nội dung: Thạch hình là một phương pháp tử hình trong đó một nhóm người ném đá vào người cho đến khi đối tượng chết vì chấn thương cùn. Nó đã được chứng thực như một hình thức trừng phạt cho những hành vi sai trái nghiêm trọng từ thời cổ đại. Việc áp dụng nó trong một số hệ thống pháp lý đã gây ra tranh cãi trong những thập kỷ gần đây.
Torah và Talmud quy định ném đá là hình phạt cho một số hành vi phạm tội. Trong nhiều thế kỷ, Do Thái giáo Rabbinic đã phát triển một số hạn chế về thủ tục khiến cho các luật này thực tế không thể thực thi được. Mặc dù ném đá không được đề cập trong Kinh Qur'an, luật học Hồi giáo cổ điển (fiqh) đã áp đặt ném đá như một hình phạt hadd (mô tả trong sharia) đối với một số hình thức zina (giao hợp bất hợp pháp) trên cơ sở của hadith (những lời nói và hành động được gán cho nhà tiên tri Hồi giáo Muhammad). Nó cũng phát triển một số yêu cầu về thủ tục khiến zina hầu như không thể chứng minh trong thực tế.
Ném đá dường như là phương pháp trừng phạt tư bản tiêu chuẩn ở Israel cổ đại. Việc sử dụng nó được chứng thực trong thời kỳ đầu của Kitô giáo, nhưng các tòa án Do Thái thường tránh ném đá các câu trong thời gian sau đó. Chỉ có một vài trường hợp cô lập về ném đá hợp pháp được ghi lại trong lịch sử tiền hiện đại của thế giới Hồi giáo. Luật hình sự của hầu hết các quốc gia đa số Hồi giáo hiện đại đã bắt nguồn từ các mô hình phương Tây. Trong những thập kỷ gần đây, một số quốc gia đã chèn các hình phạt ném đá và các hình phạt hudud (pl. Of hadd) khác vào bộ luật hình sự của họ dưới ảnh hưởng của các phong trào Hồi giáo. Những luật này có tầm quan trọng đặc biệt đối với những người bảo thủ tôn giáo do nguồn gốc kinh điển của họ, mặc dù trong thực tế, chúng đã đóng một vai trò mang tính biểu tượng và có xu hướng rơi vào tình trạng không sử dụng được.
Trong thời gian gần đây, ném đá là một hình phạt hợp pháp hoặc theo thông lệ ở Các Tiểu vương quốc Ả Rập Thống nhất, Iraq, Qatar, Mauritania, Ả Rập Saudi, Somalia, Sudan, Yemen, miền bắc Nigeria, Afghanistan, Brunei và các bộ lạc của Pakistan, bao gồm cả phía tây bắc Thung lũng Kurram và vùng tây bắc Khwezai-Baezai. Ở một số quốc gia này, bao gồm Afghanistan và Iraq, nơi ném đá là không hợp pháp, nó đã được các chiến binh, lãnh đạo bộ lạc và các quốc gia khác thực hiện theo cách phi pháp. Ở một số quốc gia khác, bao gồm Nigeria và Pakistan, mặc dù ném đá là một hình thức trừng phạt hợp pháp, nó chưa bao giờ được thực hiện một cách hợp pháp. Việc ném đá bị lên án bởi các tổ chức nhân quyền và các bản án ném đá đã gây ra tranh cãi quốc tế. Trừng phạt ngoại tình bằng ném đá có mức độ hỗ trợ từ công chúng khác nhau trong thế giới Hồi giáo, từ 86% với người Hồi giáo ở Pakistan đến 6% với người Hồi giáo ở Albania và Bosnia.

I. Kinh sách tôn giáo và pháp luật
1. Do Thái giáo

1.1. Torah

Kinh Torah Do Thái (năm cuốn sách đầu tiên của Kinh thánh Do Thái: Genesis, Exodus, Leviticus, Numbers, và Deuteronomy) phục vụ như một tài liệu tham khảo tôn giáo phổ biến cho Do Thái giáo. Ném đá là phương thức thực hiện được đề cập thường xuyên nhất trong Torah. (Kẻ giết người không được nhắc đến như một hành vi phạm tội bị trừng phạt bằng cách ném đá, nhưng có vẻ như một thành viên trong gia đình nạn nhân đã được phép giết kẻ giết người;) Các tội lỗi bị trừng phạt bằng cách ném đá là:

Chạm vào Núi Sinai trong khi Thiên Chúa ban cho Môi-se Mười Điều răn, Exodus 19:13
Một con bò làm chết người nên bị ném đá, Exodus 21:28
Phá vỡ ngày Sa-bát, Numbers 15:32 cường36
Đưa ""con đẻ"" "" cho Molech "" Leviticus 20:2 -5
Có một "" ma quỷ quen thuộc "" (hoặc là một thầy chiêu hồn) hoặc là một "" phù thủy "", Leviticus 20:27
Dụ dỗ người khác vào đa thần giáo, Deuteronomy 13:7
Nguyền rủa Chúa, Leviticus 24:10
Tham gia vào thờ phụng hình tượng, Phục truyền luật lệ ký 17: 2-7; hoặc dụ dỗ người khác làm như vậy, Deuteronomy 13:7
""Nổi loạn"" chống lại cha mẹ Deuteronomy 21:18-21.
Kết hôn như một trinh nữ, khi không còn trinh trắng, Deuteronomy 22:13 22,1321
Quan hệ tình dục giữa một người đàn ông và một người phụ nữ đã đính hôn với một người đàn ông khác trong thị trấn, vì cô ấy không hét lên báo động, Deuteronomy 22:23-24; cả hai người nên bị ném đá đến chết.
Quan hệ tình dục cưỡng bức giữa một người đàn ông và một người phụ nữ đính hôn với một người đàn ông khác, trên một cánh đồng, nơi không ai có thể nghe thấy tiếng khóc của cô ấy và cứu cô ấy, Deuteronomy 22:25-27; người đàn ông nên bị ném đá.Một trường hợp được ghi chú trong Kinh Thánh, không thuộc bất kỳ loại nào ở trên, là của Achan, bị ném đá đến chết cùng với cừu, gia súc khác và con của anh ta vì đã cướp được những vật có giá trị từ Jericho trong Cuộc chinh phạt Canaan của Joshua.

1.2. Mishna

Talmud mô tả bốn phương thức xử tử: ném đá, đổ chì nóng chảy xuống họng của người bị kết án, chặt đầu và thắt cổ. Mishna đưa ra danh sách những người nên bị ném đá sau đây.""Áp dụng ném đá cho những kẻ tội lỗi sau đây - אאלו הן הןיהן

một người đã có quan hệ tình dục với mẹ mình - על האם
với vợ của cha mình - עלעל
với con dâu của mình - על
một người đàn ông với một người đàn ông khác -
hoặc với gia súc - על
và tương tự là trường hợp với một người phụ nữ khỏa thân trước gia súc - האשההאשההמב
với một lời báng bổ -
thờ cúng biểu tượng khác - הע
người hy sinh một trong những đứa con của mình cho Molech - הנ מז למ
một người để ma quỷ nhập vào mình - בעל
một phù thủy - tiếng Tây Ban Nha
một người vi phạm ngày Sa-bát - המחללהמחלל
một người nguyền rủa cha hoặc mẹ của mình - המקלל
một người đã hành hung một cô gái đã hứa hôn - הבא נע סה
một người đã thuyết phục người khác tôn thờ các biểu tượng khác - המס
và một người đã lừa đảo cả một thị trấn - המד
một phù thủy (nam hoặc nữ) - המכשף
một đứa con trai bướng bỉnh và nổi loạn - בןVì một mình Thiên Chúa được coi là trọng tài duy nhất trong việc sử dụng hình phạt tử hình, không phải là người trần, sách Sanhedrin đã coi ném đá là cận trên giả thuyết về mức độ nghiêm trọng của hình phạt.
Câu hỏi: Theo nội dung được cung cấp, trong các tội danh sau đây, tội nào được quy định trong Torah (cụ thể là Deuteronomy) là bị xử tử bằng hình thức ném đá?","A. Quan hệ tình dục với một người phụ nữ đã đính hôn với người khác mà không có tiếng kêu cứu (Deuteronomy 22:23-24)
B. Giao cấu với gia súc (được quy định trong Mishna)
C. Nguyền rủa cha hoặc mẹ (được quy định trong Mishna)
D. Con trai bướng bỉnh và nổi loạn (Deuteronomy 21:18-21)",,,,,,"Để trả lời câu hỏi này, cần phân tích các thông tin liên quan đến Torah và Deuteronomy trong đoạn văn. Theo đoạn văn, Torah (cụ thể là Deuteronomy) quy định ném đá là hình phạt cho một số tội danh, bao gồm: 'Nổi loạn' chống lại cha mẹ (Deuteronomy 21:18-21); Kết hôn như một trinh nữ, khi không còn trinh trắng (Deuteronomy 22:13-21); Quan hệ tình dục giữa một người đàn ông và một người phụ nữ đã đính hôn với một người đàn ông khác trong thị trấn, vì cô ấy không hét lên báo động (Deuteronomy 22:23-24). Tuy nhiên, chỉ có đáp án D là trùng khớp với thông tin trong Deuteronomy.",D,D
val_0073,"Theo Tư tưởng Hồ Chí Minh, điều kiện để quyền của nhân dân được bảo đảm là gì?","A. Nhân dân làm tốt nghĩa vụ công dân đối với đất nước
B. Tăng cường hợp tác quốc tế
C. Phát triển kinh tế thị trường
D. Tôi không thể trả lời câu hỏi này","Nhân dân làm chủ thì phải tuân theo pháp luật của Nhà nước, tuân theo kỷ luật lao động, giữ gìn trật tự chung, đóng góp (nộp thuế) đúng kỳ, đúng số để xây dựng lợi ích chung, hăng hái tham gia công việc chung, bảo vệ tài sản công cộng, bảo vệ Tổ quốc, v.v.. Trong nhà nước do nhân dân làm chủ, nhà nước phải tạo mọi điều kiện để nhân dân được thực thi những quyền mà Hiến pháp và pháp luật đã quy định, hưởng dụng đầy đủ quyền lợi và làm tròn nghĩa vụ làm chủ của mình. Người yêu cầu cán bộ, đảng viên phải thật sự tôn trọng quyền làm chủ của nhân dân. Nhà nước do dân cần coi trọng việc giáo dục nhân dân, đồng thời nhân dân cũng phải tự giác phấn đấu để có đủ năng lực thực hiện quyền dân chủ của mình. Hồ Chí Minh nói: “Chúng ta là những người lao động làm chủ nước nhà. Muốn làm chủ được tốt, phải có năng lực làm chủ”1.","Điều 14 1. Ở nước Cộng hòa xã hội chủ nghĩa Việt Nam, các quyền con người, quyền công dân về chính trị, dân sự, kinh tế, văn hóa, xã hội được công nhận, tôn trọng, bảo vệ, bảo đảm theo Hiến pháp và pháp luật. 2. Quyền con người, quyền công dân chỉ có thể bị hạn chế theo quy định của luật trong trường hợp cần thiết vì lý do quốc phòng, an ninh quốc gia, trật tự, an toàn xã hội, đạo đức xã hội, sức khỏe của cộng đồng.","Chế độ xã hội chủ nghĩa mà nhân dân ta xây dựng là chế độ “dân làm chủ”, “dân là chủ” nên theo Hồ Chí Minh, với tư cách làm chủ, là chủ của đất nước, nhân dân phải làm tròn nhiệm vụ của người chủ để xây dựng chủ nghĩa xã hội, trong đó mọi người đều có quyền làm việc; có quyền nghỉ ngơi; có quyền học tập; có quyền tự do thân thể; có quyền tự do ngôn luận, báo chí, hội họp, lập hội, biểu tình; có quyền tự do tín ngưỡng, theo hoặc không theo một tôn giáo nào; có quyền bầu cử, ứng cử. Mọi công dân đều bình đẳng trước pháp luật. Nhà nước đảm bảo quyền tự do dân chủ cho công dân, nhưng nghiêm cấm lợi dụng các quyền tự do dân chủ để xâm phạm đến lợi ích của Nhà nước, của nhân dân.","Ranh giới giữa quyền con người và quyền công dân được phân định rõ ràng, khẳng định chủ thể rộng nhất của quyền con người là mọi cá nhân, mọi người đều được hưởng. Bên cạnh đó, việc đặt vấn đề nhân quyền ngay ở chương thứ hai, sau chương I về chế độ chính trị đã cho thấy việc công nhận, tôn trọng, bảo đảm, bảo vệ quyền con người được Nhà nước Việt Nam đặc biệt quan tâm. Khoản 2, Điều 14 của Hiến pháp cũng quy định rõ: ""Quyền con người, quyền công dân chỉ có thể bị hạn chế theo quy định của luật trong trường hợp cần thiết vì lý do quốc phòng, an ninh quốc gia, trật tự, an toàn xã hội, đạo đức xã hội, sức khỏe của cộng đồng"" nhằm bảo đảm nhân quyền được thực hiện một cách cân bằng, minh bạch và lành mạnh giữa các lợi ích trong mối quan hệ giữa Nhà nước với con người, công dân, cá nhân và phù hợp với các công ước quốc tế về quyền con người mà Việt Nam là thành viên.",,"Theo Tư tưởng Hồ Chí Minh, điều kiện để quyền của nhân dân được bảo đảm là nhân dân phải làm tốt nghĩa vụ công dân đối với đất nước. Điều này được thể hiện qua các tài liệu tham khảo như sau: 

- Tài liệu tham khảo 1: ""Nhân dân làm chủ thì phải tuân theo pháp luật của Nhà nước, tuân theo kỷ luật lao động, giữ gìn trật tự chung, đóng góp (nộp thuế) đúng kỳ, đúng số để xây dựng lợi ích chung, hăng hái tham gia công việc chung, bảo vệ tài sản công cộng, bảo vệ Tổ quốc, v.v.."" 

- Tài liệu tham khảo 3: ""Với tư cách làm chủ, là chủ của đất nước, nhân dân phải làm tròn nhiệm vụ của người chủ để xây dựng chủ nghĩa xã hội..."" 

Từ đó, có thể thấy rằng để quyền của nhân dân được bảo đảm, họ phải thực hiện tốt các nghĩa vụ công dân của mình.",A,A
